;ProjectName;Status;Link;About
0;Nest Quest Go: Grosbeaks;live;https://www.zooniverse.org/projects/brbcornell/nest-quest-go-grosbeaks/about/research;"The Cornell Lab of Ornithology, nestled in the Finger Lakes region of New York, is a world-renowned ornithological research, education, and conservation facility. Among our collections are more than 300,000 nest records from the North American Nest Record Card Program that ran from the 1960s until the early 2000s. Some cards pre-date the 1960s, likely because some naturalists were collecting this information before the formal program existed. Thousands of nesting birds, were observed by citizen scientists, who then submitted detailed accounts of bird nesting behavior.

Top Left to Bottom Right: Pine Grosbeak, Evening Grosbeak, Rose-breasted Grosbeak, Blue Grosbeak, and Black-headed Grosbeak. Photo Credits on FAQ Page.
NestWatch, a citizen-science project of the Lab, is working to transcribe these data in hopes of better understanding the nesting patterns of North American birds. Valuable scientific questions can be asked and answered regarding the nesting behavior of birds over time by examining historical records. We hope to bring new discoveries to light using these previously hidden datasets.
Our collection of Grosbeak cards contains many North American species, among them the Rose-breasted and Evening Grosbeaks. Using these notes and observations we hope to better understand the nesting patterns and successes of the grosbeak family.
The research potential of this information is invaluable. Join us in meeting our goal of transcribing all of these nest records to better understand and protect birds. With over 30+ years of data we hope to be able to identify some of the challenges that have been impacting the lives of nesting birds such as; predation, pollution, cowbird parasitism, human disturbance, weather, etc. Along the way we hope to learn more about the citizen scientists behind the cards and preserve the valuable data they spent hours collecting. For the love of birds and people, happy transcription!"
1;Catalina Outer Solar System Survey;live;https://www.zooniverse.org/projects/fulsdavid/catalina-outer-solar-system-survey/about/research;"Welcome to the outer solar system!
Here, you will be looking through archival data from the Catalina Sky Survey (CSS) in an attempt to discover new Trans-Neptunian objects (TNOs).
CSS is relentless when it comes to scanning the night sky for asteroids that come close to our planet. From the mountain peaks of southern Arizona, CSS operates almost every clear night making real time discoveries, and has been doing this since 1998.
CSS can find dozens of Near-Earth Objects (NEOs) in a single night by looking for objects that move within a sequence of images taken over several minutes. However, NEOs are much closer than TNOs, and therefore in these images TNOs do not appear to move at all. The timescale of minutes is far too short to detect any motion from these distant worlds.
However, using the same night-time field images acquired over several months enables us to detect the motion of TNOs!
Why are we using CSS images to search for TNOs? Unlike other surveys for TNOs and other distant objects, CSS covers more than half of the total sky instead of only small bands near the ecliptic. This wider view is where unknown objects with larger orbital inclinations and other oddities can be found.
How can I find a TNO?
Want to know what it takes to explore the farthest reaches of our solar system? Lots of work goes into the process, but the final step is up to you! Let's walk through the process of finding a TNO to see exactly where you fit in. Below are two images taken from one of the CSS telescopes of the same place in the sky about a month apart.
Can you see two tiny green circles? Don't worry if you can't. Lots of computer processing went in to identifying an object that isn't in the same place in the two images. That would be almost impossible for a human. Lets zoom in below for a closer look.
You can probably now see the two green circles. There are also two yellow circles to show where the object is in the other image. This helps us see more clearly that the object has moved. This is a great start! But if we just look at two images, we tend to find lots and lots of false detections. To help with that, we look at four images. The likelihood of four random smudges, cosmic rays, or image artifacts lining up perfectly across months of time is much less than for two images. However, four images this big is still a LOT of cosmic real estate to look at! To help out, astronomers like to animate the images. That way, real objects look like they are moving. Below is an animation of the first two images plus two more. They were all taken about a month apart from each other.
This is STILL a lot to take in. Especially if the object we are interested in has moved even further than this one. Then we would be zoomed so far out to see the whole path the moving object that we wouldn't be able to see the object, it would be too tiny in the images. Most of this image is excess space, made up of the large gaps between the objects positions. We really only care about the small space where the object would appear from image to image. So we have cut out small squares of the images, and put them right next to each other. This is what it looks like:
This is where you come in! We need you to sort through these animated images, and help us identify which ones have REAL objects like the one above! Now this is an example with a very BRIGHT and well known TNO named Makemake. Most of the new ones we detect will be much fainter. When you are ready click the Classify tab to start. A tutorial will start automatically for your first time. Once you are in the Classify tab, you can always review the tutorial by clicking the tutorial tab."
2;Boston Phoenix, 1974!;live;https://www.zooniverse.org/projects/gmecagni/boston-phoenix-1974/about/research;"The Boston Phoenix
For nearly 50 years, The Boston Phoenix was Boston’s alternative newspaper of record, the first word on social justice, politics, and the arts and music scene. Its intrepid journalists tackled issues from safe sex and AIDS awareness to gay rights, marriage equality, and the legalization of marijuana. Ads for roommates, romantic mates, and band mates—one could find all these and more in the newspaper’s probing, irreverent, entertaining pages.
It ceased publication in March 2013, but in 2015 was preserved for posterity thanks to owner Stephen Mindich’s decision in September to donate the paper’s archives to Northeastern University's Archives and Special Collections.
Research
For any researcher visiting the Northeastern University Archives and Special Collections to research Boston’s political, cultural, and social history between the 1970’s through the early 2000’s, The Boston Phoenix is always recommended as a primary resource, and is widely used both for direct research and as a pedagogical tool.
Although there is a robust description and links to descriptions of the content acquired as part of the Phoenix collection on its portal page, https://phoenix.library.northeastern.edu/home/, there are currently very few direct entry points into the collection. Either a researcher needs to have a reference to a specific article (including a date); the only other option is to browse the bound volumes.
However, the Phoenix did produce two typed card file indices to its paper, which allowed reporters to find similar articles from years past that could help them with their writing. One index is a subject index, the other is an author index. These indices have been scanned, OCRed and made available online here:
Author Indexes, 1973- 1990
Index Subjects, 1974-1986, (bulk 1974-1982)
Filed by year, each author and subject index usually consists of >1000 cards, and includes multiple entry points including date, page, section, title, author, section, and subject.
Additionally, January-June 1974 of The Boston Phoenix had been disbound and digitized for preservation purposes. (It was too fragile for public use). These issues have been made available in the DRS. So if your article is within these date ranges, you can read the article you just indexed! https://repository.library.northeastern.edu/collections/neu:cj82m7888
Goals
The primary goal of the Boston Phoenix 1974! project is to build a community of support for Phoenix publications by asking volunteers to take a deep dive into the arts, culture, politics, and topics of Boston in 1974. This community will hopefully be inspired to read articles they have transcribed and write about them on their favorite social media platform.
The secondary goal is to make the project available for educational purposes. Several faculty members have reached out looking for hands-on projects that could keep their students engaged while studying from home and/or fulfilling experiential education requirements. Educators have successfully used Zooniverse in many different curricular settings; several of these could be modified for Phoenix work. https://blog.zooniverse.org/category/education/
A completed index could also become a prime source for other digital humanities projects, tracking trends in politics, the arts, or news through time. How did so-called 'fringe' causes, such as LGBTQA rights, marijuana decriminalization, and alternative energy become mainstream? What issues in 1974 were at the forefront of the arts and politics sections of the Phoenix?
The tertiary goal of the project is to make a fielded dataset from the 1974 cards, starting with the author index (~1500 cards). If successful, the project could also be expanded to include the 1974 subject file, and to subsequent years. It will be some time before researchers have broad, searchable access to a scanned Phoenix collection that has been OCRed, and still some more time before an accurate article subject index could be created via METS/ALTO or another standard that the library might adopt in the future."
3;Iguanas from Above;live;https://www.zooniverse.org/projects/andreavarela89/iguanas-from-above/about/research;"About Marine Iguanas
The marine iguana (Amblyrhynchus cristatus) is a charismatic and endemic species of the Galápagos Islands that is threatened with extinction. The species consists of 11 subspecies, each of which is unique and important for the survival of the species as a whole. Since the marine iguana is endemic, it is not found anywhere else on earth (not even in zoos!). If it is lost from the Galápagos Islands, then it is lost forever.
Marine Iguanas are the world’s only sea-going lizard, they have amazing adaptations like absorbing their own bone matter to survive hard times, and they inspired the creation of Godzilla. However, marine iguanas face a complex combination of threats due to human activities. These threats include predation by introduced animals like cats, rats, and dogs; marine pollution from oil spills and other sources and climate change.
Conservation authorities want to help, but the problem is that marine iguana colonies are very hard to reach, and so we have never been able to collect good estimates of how many marine iguanas are left and where exactly they can be found. Without this information, effectively conserving them is very difficult (if not impossible!), and we might be losing important populations or even whole subspecies without realizing it.
About the project
By using drones to survey the marine iguana populations, we can collect high quality images from which iguanas can be counted at a later stage. This means we survey much faster and don’t need to physically visit all the colonies. And because we can send the drones from boats, we can do this work with minimal disturbance to the delicate wildlife of the islands.
Through this work, we collect a huge number of images, and it would take our small team a long time to do all the counting. This is why we are asking for your help through our project on Zooniverse. By joining in, you are making an incredibly valuable contribution to preserving the unique wildlife of the Galapagos Islands. We are confident that our Zooniverse project will give us reliable estimates of marine iguana population sizes, but to prove it we will compare these counts with those from ground-based surveys; this will ensure that our work is scientifically rigorous. In addition, you can help us collect data on other species and interesting finds on the islands, and these results will be shared with other conservationists and scientists so that many endangered species can be helped.
Right now we are processing the data from our pilot stage, where we focussed on two islands (San Cristobal and Santa Fe), but we hope to survey the rest of the Islands within the next year so that we will soon have a complete record of the size and location of all key marine iguana populations. This information will be a huge step forward in marine iguana conservation and will really help us to protect these amazing animals from extinction in a rapidly changing world.
Our main aims are to:
*Develop a safe and non-invasive surveying technique alongside a volunteer-based method for quick counting
*Publish the first reliable estimates of the size and location of three highly endangered subspecies
*Create the first species survival plan for the marine iguana to guide their effective protection
Partners
Our many thanks to these organizations that have helped to make this project a reality:
The University of Leipzig, Germany
The Galapagos Science Centre, Ecuador
USFQ Ecuador
The International Iguana Foundation
Data collected under the permit number PC-75-19, provided by the Galapagos National Park authorities.
If you would like to know more about the project, please visit our website Iguanas from Above and get involved!
Help us to achieve our objectives and save the marine iguana!"
4;Nest Quest Go: Raptors;live;https://www.zooniverse.org/projects/brbcornell/nest-quest-go-raptors/about/research;"The Cornell Lab of Ornithology, nestled in the Finger Lakes region of New York, is a world-renowned ornithological research, education, and conservation facility. Among our collections are more than 300,000 nest records from the North American Nest Record Card Program that ran from the 1960s until the early 2000s. Some cards pre-date the 1960s, likely because some naturalists were collecting this information before the formal program existed. Thousands of nesting birds, were observed by citizen scientists, who then submitted detailed accounts of bird nesting behavior.

[Top left to bottom right: Golden Eagle, Merlin, Northern Harrier, Turkey Vulture, Osprey, and Ferruginous Hawk. Photo credits on FAQ page.]
NestWatch, a citizen-science project of the Lab, is working to transcribe these data in hopes of better understanding the nesting patterns of North American birds. Valuable scientific questions can be asked and answered regarding the nesting behavior of birds over time by examining historical records. We hope to bring new discoveries to light using these previously hidden datasets.
The raptor collection consists of cards from our collection of eagles, hawks, falcons, harriers, kites, ospreys, and vultures. These large powerful birds have acute hearing and sharp vision that is eight to ten times that of humans, which helps them to detect and locate prey from up to two miles in the air. We hope these cards help us understand more about the lives and nesting habits of these fierce, intelligent hunters.
The research potential of this information is invaluable. Join us in meeting our goal of transcribing all of these nest records to better understand and protect birds. With over 30+ years of data we hope to be able to identify some of the challenges that have been impacting the lives of nesting birds such as; predation, pollution, cowbird parasitism, human disturbance, weather, etc. Along the way we hope to learn more about the citizen scientists behind the cards and preserve the valuable data they spent hours collecting. For the love of birds and people, happy transcription!"
5;Embryo Cam;live;https://www.zooniverse.org/projects/embryophenomics/embryo-cam/about/research;"CAPTURING THE MOST DYNAMIC PROCESS OF AN ORGANISM'S LIFE HISTORY
Embryonic development is the most dynamic period of an organisms' life history and has long been a period of fascination to researchers. Embryos change on a minute by minute, hour by hour and day by day basis and trying to capture this dynamic process presents a formidable challenge to scientists.
Our Research group works at the University of Plymouth where we have developed new automated technologies for recording large numbers of aquatic embryos for the duration of their embryonic development and this enables us to capture and study the fundamental process of biological development in an unprecedented way.
Our microscopes generate huge volumes of video data, the next step is to analyse it. Manual analysis is inefficient and so to analyse video efficiently we are turning to artificial intelligence (AI). We are using AI to train the computer to autonomously spot features in developing embryos. For this, we need you! By drawing around features of interest and identifying when the embryo is performing certain behaviours you will provide the computer with ""training data"" so it can learn from you!
This is an important mission because we know that early life stages are sensitive to their environments, but not how sensitive or what they are most sensitive to. We need this understanding as the environment is changing at an unprecedented rate. Therefore, we urgently need your help to generate these data!
OUR TECHNOLOGY
What is EmbryoPhenomics?
EmbryoPhenomics is a technological platform for the autonomous video recording of developing aquatic embryos comprised of a video microscope we call OpenVIM and software called EmbryoCV (computer vision).

Here are three OpenVIM systems in our laboratory
What does it do?
This technology enables us to record and monitor embryos developing under a range of experimental conditions, such as different temperatures that reflect climate change scenarios. Analysing how development is effected by changes in environment, such as changes in temperature, will help scientists understand how climate change may effect animals developing in aquatic environments.

Timelapse video of two snail embryos developing under different environmental temperatures
Why do we need your help?
Your contribution will enable us to extend these technologies to address some of the most pressing challenges of understanding how early life stages are responding to our current environmental crisis. Furthermore, these new technologies are going to be deployed both in the laboratory and out in the environment. Your data will allow us to build intelligent devices that measure what embryos are doing out in their environment! So, please help us train the next generation of technologies for helping to understand our impact on biodiversity!
What are our research goals?
The EmbryoPhenomics research group is establishing new technologies and approaches to research in marine biology and applying these to some of the most pressing research challenges of our time. Our goal is to drive forward the limits of what is currently possible in research on developmental ecophysiology and to use these new approaches to understand how early life stages are responding in a changing world.
Check out our Embryonic development Vimeo Channel to see some of the different types of species we work with."
6;A Century of Natural History Observations;live;https://www.zooniverse.org/projects/mohonkpreservedsrc/a-century-of-natural-history-observations/about/research;The Natural History Observation Card File consists of 14,000 3x5 notecards containing extensive natural history observations of the flora and fauna of the Shawangunk Ridge recorded by Daniel Smiley (1907-1989) – prominent regional naturalist and Mohonk Preserve co-founder – and other research associates. The card file, together with the Preserve’s other natural history collections and weather/phenological data, are valuable for research because of their long-term consistency, providing a record of changes in the natural world over many decades. Each index card contains information similar to a museum specimen label (i.e. date, location, observer’s name, taxonomy), and other pertinent information such as weather, behavior (for animals), phenological information, and historical context. Because these data are so extensive and have been consistently collected over so many years, they create a unique data source for scientists to conduct a range of projects. For instance, our extensive phenological records help demonstrate how climate change is affecting the natural cycles of nature. Is spring coming earlier as the months get warmer? Are animals disappearing from the landscape and invasives taking over? Digitizing this collection will help us to support new research on a variety of scientific topics. Once this project is completed, the data will be available for access on the Environmental Data Initiative platform.
7;AI4Mars;live;https://www.zooniverse.org/projects/hiro-ono/ai4mars/about/research;"Our Motivation
Terrain is important to get around on Mars. Spirit got stuck in a sand pit and ended its mission after 7 years of exploring Mars (but far exceeding its nominal mission length of 90-days). Opportunity and Curiosity also have experienced getting stuck in sand, although they were able to continue on their missions. Don’t you think it would be nice if the Mars rover could identify dangerous terrain by herself? That is what a team at NASA Jet Propulsion Laboratory is working on using Machine learning – essentially the same technology used by self-driving cars on Earth. To do so, the rover needs training data to learn from.
The Problem
On Earth, researchers across the globe have managed to curate many different datasets for things we encounter in day-to-day life, such as house numbers, cityscapes, random stuff, and maybe most importantly, puppies and kittens!
Sadly, all of this data is of little use for mission critical, autonomous exploration of other celestial bodies...
Our Goal
We're counting on citizen scientists' help in labeling a set of images captured by Mars rovers so that we collectively create the Solar System's first public benchmark for Martian terrain classification. Uncrewed space exploration will depend on the rover knowing where it's safe to drive, land, sleep and hibernate; this project is an early step in that direction.
The Dream
With this dataset, we (that includes YOU) will be able to start work on new machine learning approaches for exploring Mars.
If you want to know more about our Mars rover missions...
Mars 2020 Rover
Mars Science Laboratory (Curiosity)
Mars Exploration Rovers (Spirit & Opportunity)
Our research on Mars rover AI...
On-board terrain classification (SPOC-Lite)
Machine Learning-based Analytics for Automated Rover Systems (MAARS)
Publications
MAARS: Machine Learning-based Analytics for Automated Rover Systems, M. Ono et al., to be presented in IEEE Aerospace Conference, 2020
Vision-Based Estimation of Driving Energy for Planetary Rovers Using Deep Learning and Terramechanics, S. Higa et al., IEEE Robotics and Automation Letters, 2019 [pdf]
Make Planetary Images Searchable: Content-based search for PDS and On-Board Datasets, M. Ono et al., LPSC 2019 [pdf]
SPOC: Deep Learning-based Terrain Classification for Mars Rover Missions, B. Rothrock et al., AIAA SPACE 2016 [pdf]"
