;ProjectName;Status;Link;About
66;SuperWASP Variable Stars;live;https://www.zooniverse.org/projects/ajnorton/superwasp-variable-stars/about/research;"SuperWASP Variable Stars
Stars are the building blocks of the Universe and determining stellar parameters is a cornerstone of astrophysics. Variable stars are the key to this, as their time domain signal may be used to probe the dynamics or structure of a stellar system. The first step in such research is to identify and classify samples of variable stars, and that is the purpose of this project.
Classification of periodic variable stars based on the shape of the photometric variability displayed in their folded lightcurves is not always a conclusive way of uniquely determining their type. However, it can at least give a good indication of the possible type and identify candidates that are suitable for follow-up investigations, often involving spectroscopy.
SuperWASP is the Wide Angle Search for Planets, but the results it obtains also comprise a unique data set for exploring stellar variability. The SuperWASP stellar photometry archive is distinctive in two key ways. First, it is an all-sky survey (excluding only the Galactic plane) and so covers a homogenous sample of bright stars. Second, the lightcurves have both high cadence (many observations per night) and long baseline (spanning many years), so can be used to search for variability on all timescales from hours to years.
The purpose of identifying and classifying periodic variable stars in the SuperWASP data is also twofold. The first purpose is to identify large catalogues of objects of a similar type which can then be studied en masse to determine characteristics of the population; and the second purpose is to identify rare objects displaying unusual behaviour, which can offer unique insights into stellar structure and evolution.
Pulsating stars
Some stars exhibit periodic changes in brightness that are due to changes in the star's size and luminosity as its outer layers expand and contract in a regular manner. These so-called pulsating stars come in several varieties. Measurements of stellar pulsations are used to determine parameters of stars such as mass and radius. These deductions are based on stellar models, so large populations of such stars need to be investigated to test the models. Some of the most common types of pulsating star are RR Lyrae stars, Delta Scuti stars, Cepheid variables and Mira variables.
RR Lyrae stars are post main sequence, giant stars sitting on the so-called horizontal branch of the Hertzsprung-Russell diagram. As such they all have very similar intrinsic luminosity. They have pulsation periods typically around half a day. The RRab subtype have characteristic pulsation profiles with rapid increase in brightness followed by a more gradual decline, whilst in the RRc subtype the profile is less asymmetric. A large (but unknown) proportion of RR Lyrae stars display the so-called Blazhko effect which is an amplitude and/or frequency modulation of the pulse profile with a period of tens or hundreds of days.
Delta Scuti stars are main-sequence stars or sub-giant stars of early spectral type and exhibit pulsation periods of a few hours. Their pulsation profiles are typically saw-tooth in shape with a rapid rise and slower decline.
Cepheid variables are giant or supergiant stars with pulsation periods of days to months, whilst Mira variables are evolved stars on the asymptotic giant branch, and display pulsation periods of more than 100 days, often several years. Like other pulsating stars, the pulsation profiles of these types of star also display a relatively rapid increase in brightness followed by a slower decline.
In this classification project, it is often difficult to distinguish these different types from their folded lightcurves alone, so all types will simply be classified as pulsators.
Eclipsing binary stars
Eclipsing binary stars are systems in which two stars orbit around their common centre of mass. If the system is aligned such that the plane of the orbit is close to our line of sight, each star will pass in front of the other once per orbit, so giving rise to two eclipses per cycle. Eclipsing binary stars are the only systems in which stellar masses and radii can be directed measured by dynamical means.
If the two stars are well separated, eclipses will be relatively narrow and there will be little or no brightness variation outside of the eclipses in these detached binaries. These stars are classified as Algol type eclipsing binaries or EA type for short. The primary and secondary eclipses will generally be V-shaped and of different depths; they will be separated by 0.5 in phase if the orbits are circular, but can be offset from this if the orbits are appreciably elliptical. If the two stars are closer, one may fill its equipotential surface (known as its Roche lobe) and so be distorted into an ellipsoidal shape. In these semi-detached binaries, there can be a smoothly varying brightness outside of the eclipses as the distorted star presents a changing cross-sectional area. The primary and secondary eclipses are again usually of different depths. These stars are classified as Beta Lyrae type eclipsing binaries or EB type for short. In practice there is a continuous distribution from EA type to EB type and it can often be difficult to distinguish between them, so in this project you will classify such objects as EA/EB type.
Here's an excellent diagram from Kang Young-Woon (Journal of Astronomy and Space Sciences Volume 27, Issue2, p75~80, 15 June 2010) which illustrates a range of detached and semi-detached eclipsing binaries.
If the two stars are so close that both fill their Roche lobes, the two stars are in contact. Matter can flow between the stars which will therefore generally be at the same photospheric temperature. The stars will also be tidally locked such that their rotations match the orbital period. The primary and secondary eclipses will generally be of similar, sometimes identical, depth and there is a continuous brightness variation through the orbit. Sometimes one maximum will be brighter than the other, due to the presence of star spots on one of the stars - this is known as the O'Connell effect. Due to the proximity of the stars, their orbits will always be circular, so the two eclipses will be 0.5 apart in phase. These stars are classified as W Ursae Majoris type eclipsing binaries or EW type for short.
Here's an illustration of a contact binary and its associated lightcurve from BotRejectsInc (http://cronodon.com/SpaceTech/AstroTech.html).
Precise measurement of the eclipse times in eclipsing binaries can lead to measurements of how the binary orbital period is changing with time. If the period is increasing, the stars must be getting further apart; if the period is decreasing, the stars must be getting closer together and may eventually merge. If the period increases and decreases in a periodic manner, that may instead be due to a varying light travel time effect and indicate that the binary is itself in orbit with a third star in the system (see ""Results"").
Rotationally modulated stars
Stars displaying rotational modulation may be single stars with significant star spots on their surface. As such stars rotate, their apparent brightness will vary, so giving rise to a continuous, often sinusoidal, variation in brightness. There is a (poorly understood) relationship between a star's rotation period and its activity, so samples of rotational variables can be used to investigate this phenomenon.
Other rotational variables are close binary stars that do not eclipse one another, but are distorted into non-spherical (ellipsoidal) shapes by gravity due to their proximity. As such stars rotate around one another, they present a varying surface area to our line of sight and give rise to so-called ellipsoidal modulation in their folded lightcurves. These stars too will exhibit sinusoidal variations in their folded lightcurves.
In this classification project, both types will simply be referred to as rotators.
Multiply periodic stars
Multiply periodic stars are those which display more than one coherent periodic modulation in their lightcurve. These can include hierarchical multiple stellar systems, where a single point of light actually comprises (for instance) four stars composed of two eclipsing binary systems in orbit around their common centre of mass. The periods of both eclipsing binaries may be present in the lightcurve. We have previously identified the only known doubly eclipsing hierarchical quintuple star (see ""Results"") from SuperWASP data. Such hierarchical multiples can be used to investigate how stars form and evolve.
Another cause may be a pulsating star in an eclipsing binary system such that the lightcurve displays modulation at both a pulsation period and an eclipsing binary period. These systems are important as they allow dynamical stellar masses and radii to be measured and compared with the predictions of stellar pulsation models in the same system. We have previously identified a bright Delta Scuti pulsator in a semi-detached eclipsing binary with one of the largest pulsation amplitudes of any such system known (see ""Results""). Around a hundred or so Delta Scuti stars are known in eclipsing binaries, but there are no known RR Lyrae stars in eclipsing binaries."
67;South Sudan DiversityCam;live;https://www.zooniverse.org/projects/southsudanwildlife/south-sudan-diversitycam/about/research;"South Sudan… extraordinarily biodiverse
The vast nation of South Sudan is characterized primarily by moist savanna and montane forests, with over 280 mammal species historically recorded. These include eastern chimpanzee and 11 other primates, both species of African elephants, multiple felids and other carnivores, and over 100 species of bat. We primarily work in the southwestern corner, a unique tropical forest belt linking the biomes of Central and East Africa. Biodiversity monitoring has been central to our program since 2012. An understanding of the basic fauna and flora of an area is important in interpreting the overall health of an ecosystem and is fundamental to all other efforts, as it drives conservation planning and reserve management.
…but plagued by conflict
Although rich in culture, biodiversity, and resources, South Sudan’s people are among the poorest in the world. Continued conflict has blocked research and conservation for decades, and both people and wildlife continue to suffer greatly from the costs of war. South Sudan is in the fourth year of its current civil war which – like its two previous civil wars – falls along ethnic lines and urban/government versus rural/opposition lines. FFI, in collaboration with Bucknell University, is one of a very small number of wildlife conservation actors continuing to operate on the ground in-country.
Conservation Importance
During the current conflict, poaching as a source of life-sustaining protein has increased as has the opportunity for illegal extraction of natural resources including logging and deforestation. The national authorities for wildlife conservation are incapacitated: funds have been cut, salaries are paid late, and there is no financial allocation for institutional operational costs. In many areas across other parts of the country, Wildlife Service personnel have returned to their military role and are fighting on different sides of the civil war. This is a complex political environment, but FFI and Bucknell are well positioned: previous relationships with government and communities have put them in a neutral position, enabling them to conduct impartial conservation activities, bringing together a variety of actors.
Study Location
Our study area in the dense tropical forests of southwestern South Sudan presents many conservation opportunities. The area’s wilderness, small human footprint, and undeveloped protected areas offer the opportunity for recovery and sustainment of both wildlife and human populations. There exists a latent knowledge of the importance of protecting these natural resources, but for decades nothing concrete had been done about it.
Aiding conservation through biodiversity surveys and community involvement
Extensive camera trapping efforts have yielded ~425,000 images, and efforts continue. Camera traps are a powerful tool both for documenting biodiversity and for estimating abundance and species distributions. They are proving critical to our studies of elephants and chimpanzees and have offered insights on species range expansions and new country records.
The South Sudan Wildlife Service is a key partner, as are nearby communities, who are trained to protect and monitor the cameras as part of a wider project that supports community-led natural resource management. The Wildlife Service and community members have come together in order to develop a model of joint ownership for wildlife conservation. Community members were trained and named Community Wildlife Ambassadors (CWAs). This has maintained collaboration and stability between the government and rural communities in the area where camera traps are deployed, enabling wildlife conservation activities to continue. CWAs support the State Wildlife Service (WLS) in the management of the reserves by conducting regular wildlife patrols and managing camera traps. Rangers are trained and gain literacy, map navigation, and technology skills. Through patrolling, reporting, and using their new navigation and GIS skills, CWAs gather valuable information about the reserve and surrounding area. This information is used to inform patrol plans and aid the monitoring and protection of wildlife. We are also expanding work into human livelihoods, recognizing that poaching and unsustainable resource use increases when people are food insecure.
Our camera trap program is now in its second year. We continue to move the cameras to different areas, and need your help identifying animals in the camera trap photos! Your identifications will help us understand biodiversity, abundance, behavior, and distributions, which will ultimately lead to better conservation planning in this extraordinary environment. Thank you for your help!"
68;Snapshot Hoge Veluwe;live;https://www.zooniverse.org/projects/y-dot-liefting/snapshot-hoge-veluwe/about/research;"De Hoge Veluwe National Park in the Netherlands has a wildlife monitoring system that is unique in the world: a network of dozens of camera traps that continuously monitor the activity of the animals in the Park. The network is unique because of the large quantity of cameras that are placed randomly throughout the the Park, the long time duration that they have been monitoring ánd the fact that the Park is largely fenced, meaning that there is a high level of monitoring possible on the wildlife that is inside.
Every year these cameras provide us with over a million pictures. In the past couple of years we were able to process a quarter of these, with the help of a group of trained volunteers. Through this Snapshot Hoge Veluwe project we want to include you, the public, in this photo analysis process. In this way we hope to get a lot more information out of our already existing camera network. Opening up the database to the public of course has the added benefit that you get to learn about the amazing wildlife in our Park. We love to connect with more nature enthusiasts!
What is being researched and why is this important?
The data that is gathered with the camera network has been used by researchers since 2013 to monitor the behavior of the wildlife in the Park. How many animals are in the Park? How do they make use of the different habitat types, such as heathland, game pastures and forest. How does the presence of the animals affect the plants? When are the animals most active? How do they respond to visitor activity? These and many more questions are at the heart of research that makes use of the network of cameras.
Answering these questions is important because increasing numbers of deer can be found in the Dutch natural areas. These natural areas are also being connected by green bridges and crosswalks for wildlife to counter fragmentation of their habitats. Since 2013, De Hoge Veluwe National Park also has two of such crosswalks that allow deer and other wildlife to move across the roads adjacent to the Park. To measure the effects of the wildlife crossings, we have installed a network of camera traps in 2013. With these images researchers can track which animals have visited which place at which time. It is important to monitor the effects of this increased connectivity, because too much wildlife can also damage the biodiversity in the Park (through grazing, trampling or rooting), or cause problems for traffic and agricultural areas. At the same time, a certain population density of the wildlife is beneficial to the biodiversity in the Park and it is important that visitors are able to spot the animals. Research into the behavior of the animals helps Park managers to make the right management decisions.
Another important question is around the influence of visitors on the wildlife. Before January 2016, visitors were allowed to wander outside of the paths in areas that were not classified as quiet areas. However we noticed that this caused disturbance to the animals, so we changed the policy and now everyone has to stay on the paths. Using data from the camera traps could help us get a better understanding of the effect of this policy change. As you can see, we can really use your help with analyzing all of these pictures!
About Hoge Veluwe National Park
The Hoge Veluwe National Park in some key figures: the Park covers an area of 5.400 hectare, of which 3.200 hectare forest, 2.100 hectare heathland and 60 hectare of drift sand. The Park has 3 entrances: Hoenderloo, Otterlo and Schaarsbergen, of which the Otterlo entrance is the most used. We have some 570.000 visitors yearly, of which 345.000 people also visit the Kröller-Müller Museum which is located inside the Park boundaries. The Park is home to roughly 220 mouflons, 180 red deer, 200 roe deer, 50 wild boars and an unknown amount of fallow deer, but the exact number of animals differs throughout the seasons. More information about the Park can be found here.

For a more detailed map including the three entrances, see here."
69;Manatee Chat;live;https://www.zooniverse.org/projects/cetalingua/manatee-chat/about/research;"Manatee Chat Project
Manatee acoustic communication has not been studied extensively because it has been believed that manatees have a very limited communication system, which acts mainly as a contact call between a mother and calf. This project will investigate the form and function of manatee vocalizations, and it will allow us to learn more about what signals manatees produce, what potential function they might serve, and what differences individual manatee calls have.
The project's overall goal is to analyze the acoustic (and later video) data sets with the help of citizen scientists. Part of this analysis will be used to train a deep learning system to identify and classify manatee calls. This is phase one of the project in which the citizen scientists are asked to identify and count manatee calls.
Florida Manatee
Florida Manatee (Trichechus manatus latirostris) is a part of lineage of sirenians that are 50 million years old. While there is some evidence of 35 sirenian species existing over this period of time, today we only have four species left that belong to two families (Dugongidae and Trichechidae). Trichechus manatus latirostris is Florida subspecies and is a part of this project. Manatees feed solely on aquatic vegetation and have no natural predators apart from humans. According to the last aerial survey, Florida currently has 6620 manatees. Even though manatees were recently downgraded from Endangered to Threatened status, they face many challenges, as many die from boat related injuries, toxic algae blooms, entanglements, and cold stress.
Manatee Calls
Manatees have good hearing with an overall hearing range between 500 Hz and 38,000 Hz. The range of the vocalizations is between 3 and 20 kHz (Reep & Bonde, 2006). Manatees are very vocal and produce at least several different types of calls (Umeed et al., 2017; Mann et al., 2006). Although it has been proposed that the main function of manatee vocalizations is to serve as the contact calls between a mother and calf (O'shea and Poché Jr, 2006), there is at least some anecdotal evidence that unrelated manatees might also use calls for social purposes. At this stage, we simply ask for your help to determine if there is a manatee call in the sound file and also to count how many calls you hear in the audio file and see on the spectrogram. Once you start working on this project, you will be amazed by the diversity of calls produced, and you'll discover how manatees appear to call back in response to certain calls.Manatees have somewhat unusual calls because many people expect some sort of low frequency grunts based on the manatee’s size, but the actual calls sound more like bird chirps.
Other Sounds
The underwater environment is rarely silent. Since the recordings were made at the Lowry Park Zoo Manatee Hospital and Rehabilitation Center you will hear many other sounds (learn more in the Project Tutorial and the Field Guide ). You will hear the following: mastication (chewing) sounds that could help to identify the feeding events, mechanical sounds from the recording equipment, filter sounds, some other sounds when manatees rub against the underwater hydrophone, and in some cases you will even hear people talking in the manatee exhibit area.
Data Collection Site

The data was collected over a period of several years at the Lowry Park Zoo (now Zoo Tampa at Lowry Park) Manatee Hospital, Tampa, Florida, USA. Zoo's David A. Straz, Jr. Manatee Critical Care Center is one of the most important manatee rehabilitation facilities in Florida. It has been taking care of sick, injured, and orphaned manatees for more than two decades. Over 20 manatees (males and females) were observed and recorded, their ages differed from just few months old to over twenty years old. Our data sets included both video and audio, but phase one of this project will only include audio data.
Update 03/31/2020: A New Freshwater Dataset Added

Image by Jay Dodge. Manatees at Blue Springs in Orange City, FL
We have added a new dataset graciously shared with us by the Sirenian International nonprofit organization. Their mission is to promote the conservation of manatees and dugong populations around the world through research, education, and inter-cultural collaboration. Please check their website here to learn more. These recordings were made in pristine Florida springs in the presence of dozens (even hundreds) of manatees. You will appreciate the amazing soundscape of Florida springs and the protected freshwater manatee habitats free of anthropogenic noise (and also free of snapping shrimp that dominate salt water manatee habitats). There are also some amazing manatee calls there, so make sure to try out this new, exciting workflow.
Project Significance
Manatee acoustic communication has not been studied extensively, and we still do not know the potential function(s) of manatee calls beyond mother and calf contact. Additionally, categorizing calls and later relating them to behavioral states and events could help make a better sense of the data recorded in the future via passive acoustic recorders. Finally, understanding the categories of manatee calls and individual variations could help create a system for tracking manatees via passive acoustic recordings and potentially warn boaters about a manatee presence in the area.
Note: The white scars on this juvenile manatee's back are from a boat propeller.
References:
Mann, D. A., O'Shea, T. J., and Nowacek, D. P. (2006). Nonlinear Dynamics in Manatee Vocalizations. Marine Mammal Science, 22(3), 548-555.
O'shea, T. J., and Poché Jr, L. B. (2006). Aspects of Underwater Sound Communication in Florida Manatees (Trichechus manatus latirostris). Journal of Mammalogy, 87(6), 1061-1071.
Reep, R. L., & Bonde, R. K. (2006). The Florida manatee: biology and conservation. University Press of Florida.
Umeed, R., Attademo, N., Löffler, F., and Bezerra, B. (2017). The Influence of Age and Sex on the Vocal Repertoire of the Antillean Manatee (Trichechus manatus manatus) and Their Responses to Call Playback. Marine Mammal Science. DOI: 10.1111/mms.12467"
