;ProjectName;Status;Link;About
208;Weddell Seal Count;paused;https://www.zooniverse.org/projects/slg0808/weddell-seal-count/about/research;"Summary
We want to count how many Weddell seals there are in the Ross Sea area of Antarctica. Only then can we tell if they are being adversely affected by human fishing for toothfish, or by the ice melting away beneath them due to climate change. But it is really hard to count seals – they live in very remote hard-to-reach locations where weather conditions are extreme, and they spend a lot of their time in the water. But during the summer they haul out onto the ice for some time each day. If we can count them then, and also understand the typical pattern of numbers out on the ice, then perhaps we can make reasonable estimates of the population.
In October 2016 the nations represented at the Commission for the Conservation of Marine Living Resources (CCAMLR) reached consensus on a New Zealand/United States proposal to establish the world's largest marine protected area (MPA) in the Ross Sea region. The Agreement will enter into force on 1 December 2017. The ability to monitor the health of the MPA will be very important in assessing its effectiveness.
The Ross Sea region of Antarctica is home to more than half the total population of Pacific Weddell Seals. Weddell seals and orca are among the top predators in the Ross Sea region, and act as sentinel species for the ecosystem. Knowledge of changes in their population numbers would give important insights into the health of the whole ecosystem, and the effectiveness of the MPA. It has been demonstrated that it is possible to identify seals hauled out onto the ice in satellite images, although they are at the limit of picture resolution. Satellites potentially provide a great way of covering the enormous area of the western Ross Sea, and therefore helping to monitor the population of the entire region.
However, previous studies have shown that the number of seals visible depends strongly on the time of day, sometimes by as much as a factor 10. To get a reasonable estimate of the total population from the number counted from an image taken at one time, you need to know what fraction of the population you might expect to see on the ice at that time of day.

A Weddell seal mother-pup pair asleep on the ice. Photo: R. Eisert
We would like to understand the daily rhythm of the seals hauling out onto the ice. We have pictures from two cameras on Turtle Rock, off Ross Island, showing seals hauled out near tidal cracks in the sea ice. The cameras were automated to take pictures at 10-minute intervals over a period of weeks during the breeding season in November and December 2014, and again in 2015. By counting the seals in the pictures we can plot the numbers not only over one or two days, but several months, helping us better understand the daily pattern of haul out and how it changes during the season.
Background
Weddell seals (Leptonychotes weddellii) are found all around Antarctica, with McMurdo Sound (77°S) the most southerly extent. They are the most southerly breeding mammal and are the only Antarctic marine mammal that lives preferentially within areas of fast ice, that is, sea ice adjacent to land or ice shelves that is continuous except for small cracks caused by tidal action. The seals haul out onto the ice surface to rest, in spring to give birth to and nurse their pups, and in January to March to moult prior to the melt of the sea ice. While in the fast ice far from open water, the seals and their pups are safe from predators such as killer whales and leopard seals that are unable to cross closed ice. Weddell seals can locate the tide cracks in the ice that form near headlands, islands and glacier fronts, and make and maintain holes that allow them to breathe and haul out. Unlike other seals, Weddell seals have protruding canine teeth and caniniform (canine-like) second incisors that they use to abrade the ice and create holes along tidal cracks, where the ice is much thinner than elsewhere. The ability to find and maintain holes deep within the fast ice gives Weddell seals access to the water to feed, and for breathing when in the water. The downside of the specialised fast-ice niche of the Weddel seal is that life expectancy is limited by tooth wear.

A Weddell seal mother and her newborn pup. Photo: R. Eisert
In this project, we are particularly interested in the seals in the south-western extreme of the Ross Sea, in McMurdo Sound (ca. 77°20'S, 165°20'E). Weddell seals show a strong preference for returning to the place of their birth. During the breeding season, females rearing their pups gather in colonies along cracks in the fast ice starting in mid-October. They are joined by some other females. Meanwhile, the adult males patrol stay in the water and patrol their claim along the tidal crack - these areas are called 'maritories in analogy to 'territories' - and are rarely seen on the surface unless they are soundly defeated. It is common for injured males to haul out onto the sea ice and there die from their injuries.
The diagram below shows the Ross Sea, and the zones of the Ross Sea Marine Protected Area. In the in-set the region is shown in relation to New Zealand.

Source (MFAT)
Ross Island is a volcanic island at the edge of the Ross Ice Shelf, and has two large mountains at its centre, including the active Mt. Erebus (3,794 m). The picture below shows the bay into which the Erebus Glacier Tongue empties, on the south-western side of Ross Island. Weddell seals gather around the islands and places where the tidal movement weakens the sea ice as it presses against the land.

Map of eastern McMurdo Sound (Erebus Bay) with locations of seal colonies, and location of the camera site used in this project.
A satellite picture can capture large areas in a single image, and it is possible to zoom in so that you can see the dots of seals hauled up on the ice.

Courtesy of Google Earth, a satellite image of Turtle Rock with the seals visible as small black dots. I have indicated the location of our cameras.
However, the drawback of satellite images is their relatively low resolution that makes is difficult to count the seals accurately. Pups cannot be distinguished from adults and fail to be detected due to their smaller size. On the other hand, it would be very helpful to be able to make use of aerial or satellite images because they cover very large areas much more efficiently than travelling out onto the ice and surveying by counting on the ground. This is particularly important if we want to estimate the entire population of the western Ross Sea, i.e., the seals influenced by the Ross Sea Region MPA. The islands in Erebus Bay are only kilometres apart, and manual counts take days or weeks, and are expensive because of the logistics required to move around. The northern extent of the western coastline of the Ross Sea, Cape Adare, is 750 km away and only reachable by air in good weather.

Counting seals in a colony on foot. Photo: P.H. Ensor
Satellite or aerial pictures can give a snapshot of the seals on the ice at one moment during the day. We know that the numbers of seals above and below the ice vary very significantly during the day, up to a factor of 10 over a 24-hour cycle. Thus, to be able to compare pictures taken at different times, and to infer total numbers by correcting for seals invisible below the ice, it is important to have a good understanding of the daily haul-out cycle and whether (how) it changes throughout the seasons. That is what we are seeking to achieve in this study, through taking photographs at 10 minute intervals from the same location over a long period of time.
Two land-based automated cameras captured images in two directions from points on Turtle Rock, Erebus Bay. The pictures were taken every 10 minutes over the periods from 27th November 2014 through to 01st January 2015. After that, we had to move the cameras because the ice became unstable, cutting off our access to the island. We have approximatley 10,000 pictures altogether. We are asking Zooniverse volunteers to help us count the seals in these pictures.

A view of Turtle Rock from the west, with Ross Island in the background. For most of the year, this tiny island is enclosed by ice. Tidal cracks form to the north and south of Turtle Rock. Photo: R. Eisert
Concerns about the impacts of fishing upon Weddell seals.
The picture below shows in schematic form the main elements of the food web in the Ross Sea. Weddell seals are top predators, feeding on krill, squid, silverfish and toothfish, in order of increasing size. The picture shows that they compete for toothfish with type-C killer whales and human fisheries.
Toothfish are important to Weddell seals because they provide a very high-energy-density source of food, potentially key to allowing seals to recover from enormous weight-loss during the breeding season. Weddell seal pups weigh about 25 - 30 kgs at birth, but within the 6-8 weeks reach about 70-140+ kg., gaining approximately 2-3 kg/day. Mothers lose up to 40% of their body mass while feeding their pups. Males also lose significant body weight during the breeding season, because they spend all their time in the water around the access holes defending their territory and have no time to feed.

A Weddell seal with a very large toothfish she has just caught. Photo: R. Eisert
After losing almost half of their postpartum weight during the period October to December, Weddell seals feed intensively to regain condition, but this is interrupted by the annual moult. It is an area of active research to investigate their feeding patterns during this period. While there are plenty of toothfish in McMurdo Sound, Weddell seals could be affected if the availability of toothfish during this critical period is decreased. If there are fewer toothfish, then potentially it is more difficult for the seals to recover from the loss of body mass during the breeding season, and are therefore less fit to breed the following season, which in turn impacts the population numbers.

A freshly caught Antarctic toothfish (Dissostichus mawsoni). This specimen weighed more than 30 kg. Photo: R. Eisert
Fishing quotas for toothfish are regulated by CCAMLR and are derived from a precautionary approach, which seeks to ensure that stocks are harvested in a sustainable manner. It is a matter of on-going debate as to the extent of fishery impacts upon toothfish populations and other top predators. Protecting the foraging areas of marine mammal predators including Weddell seals was an important motivation for the establishment of the Ross Sea region MPA. This highlights again the need for effective monitoring programmes which can deliver robust estimates of current populations. This project seeks to contribute to the development of effective monitoring of Weddell seals through a better understanding of the patterns in their visible presence on the ice.
References
Science Learning Hub (2017). Food web in the Ross Sea. Retrieved from https://www.sciencelearn.org.nz/images/323-the-food-web-in-the-ross-sea
MFAT. (2016). Ross Sea Marine Protected Area. Retrieved from https://www.mfat.govt.nz/en/environment/antarctica/ross-sea-region-marine-protected-area/"
209;WildCam Darién;paused;https://www.zooniverse.org/projects/wildcam/wildcam-darien/about/research;"Darién and Soberanía National Parks
We are studying jaguars at two sites in Panama: Darién National Park and Soberanía National Park. Although both are tropical forests, they differ in terms of their wildlife and human presence in the park. Darién is an extremely remote park located on the Colombian border and can only be reached by boat or on foot. The tropical forest ecosystem is nearly pristine and is home to many large animals like jaguars, pumas, tapirs, peccaries, harpy eagles, and macaws. But as people establish cattle ranches and farms in the surrounding area, the park’s wildlife is becoming threatened. In contrast, Soberanía has long been affected by human activities due to its location alongside the Panama Canal and close proximity to Panama’s two largest cities. Many of the large animals that are found in Darién have either disappeared or are very rare in Soberanía. We are using trail cameras to study which animals are continuing to thrive in Soberanía, and how jaguars and other large animals in Darién are responding to an increasing human presence in the area.
Jaguar Research
Our research is focused on jaguars and two of their main prey animals: tapirs and white-lipped peccaries. Tapirs and peccaries are large herbivores that play an important role in tropical forests by dispersing seeds. Jaguars are the top predators in this ecosystem and keep herbivore numbers in check, maintaining the food web in equilibrium. Because all three species are sensitive to any environmental disturbance and populations are relatively small, any changes in species numbers can signal to scientists a change in the health of the forest. Our main goal is to identify the environmental and human factors that affect the numbers, habitat use, and movements of these three species.
One of our research tools consists of trail cameras that we set up at locations where jaguars, tapirs, and peccaries are likely to pass. The cameras have motion sensors that snap a photo when an animal moves by. Cameras are placed in pairs to photograph both sides of the animal. Because jaguars and other spotted cats have slightly different patterns on their left and right sides, having both sides photographed enables us to recognize individuals. Cameras are set up at each site for several months. We visit each site regularly to check that the cameras are still working, replace the batteries, and change the memory cards that store thousands of images.
In Soberanía, jaguars and tapirs are rare, and white-lipped peccaries have been gone for many decades. We began using trail cameras here in 2013 to monitor these species and document their presence to ensure their continued protection. In Darién, where all three species are more common, we have placed a larger network of trail cameras at several locations both near settlements and in undisturbed forest to study how humans are impacting these species. Trail cameras not only help us to understand animals’ lives, but also provide critical information on how to protect them and conserve the ecosystems they inhabit.
Help Us Collect Data
We have collected thousands of photos (and counting), and we need your help to identify the animals in these photos! Your identifications will build a data set that scientists can use to learn more about the animals in Darién and Soberanía. This information helps us understand how the animals in the park are responding to humans and identify ways to better protect them. Ready to get started?
Get Started!"
210;Colorado Corridors Project;paused;https://www.zooniverse.org/projects/coloradocorridorsproject/colorado-corridors-project/about/research;"How You Can Help
Our remote-triggered cameras collect tens of thousands of photos each year. Because of this overwhelming amount of data, we need your help identifying the wildlife you see in these photos. With your help, we can process and analyze the data much faster than if we did it on our own. Also, we hope that you will enjoy looking at the diversity of wildlife on Vail Pass. Please read below for more information on the project. Thank you for your support!
Background
The Vail Pass Wildlife Byway on Interstate 70 (I-70), between Copper Mountain Resort and the top of Vail Pass, has long been identified as an important movement corridor for wildlife in Colorado. Most recently, the Summit County Safe Passages for Wildlife Connectivity Plan (the Plan), initiated by the U.S. Forest Service, identified the Vail Pass Wildlife Byway as a top priority area in which to focus wildlife mitigation efforts in the near term. The Plan, completed in 2017, was developed by a diverse group of stakeholders and provides a common vision for multi-species landscape connectivity throughout the county.
The Vail Pass Wildlife Byway, encompassed entirely by the White River National Forest, is important habitat for many wildlife species, including elk, mule deer and the only known breeding population of Canada lynx in Colorado outside the southwest corner of the state. Yet wildlife movement and habitat in the area are at risk due to the heavy and increasing traffic volumes on I-70, up to 22,000 vehicles on an average day. This much traffic presents a significant barrier to wildlife, with many animals no longer attempting to cross the roadway, or doing so unsuccessfully. Moreover, collisions with wildlife pose an extraordinary safety concern for motorists, resulting in property damage, injuries and fatalities, at a cost to society of $66.4 million per year in Colorado.
Wildlife Overpasses and Underpasses: A Solution
To restore connectivity in the area, three wildlife crossing structures – one overpass and two underpasses – have been recommended in the Plan to allow for the safe passage of wildlife over or under I-70 in the Vail Pass Wildlife Byway. Such structures, if instituted across North America, would more than pay for themselves in a matter of years, reconnecting the landscape and reducing collisions with wildlife by as much as 97 percent.

Illustration of an overpass (not currently built). Photo credit: HNTB, MVVA, ARC Solutions (arc-solutions.org)
Wildlife Monitoring with Remote Triggered Cameras - Colorado Corridors Project
Wildlife monitoring is an essential step in assessing whether wildlife crossing structures are effective in restoring connectivity for wildlife moving across the landscape. The Colorado Corridors Project is an initiative of Denver Zoo and Rocky Mountain Wild to engage volunteers in wildlife monitoring at the Vail Pass Wildlife Byway proposed overpass location. Volunteers assist with setting up and checking remote-triggered cameras in the field as well as identifying and cataloging species captured on the cameras through Zooniverse. The wildlife data that volunteers help us collect through this project will be used to assess the effectiveness of the wildlife crossing structure by comparing data collected before and after construction of the overpass."
211;Galaxy Nurseries;paused;https://www.zooniverse.org/projects/hughdickinson/galaxy-nurseries/about/research;"Baby galaxy hunters
From dazzling spirals to mammoth ellipticals to wispy dwarfs, galaxies have been fascinating people since they first appeared in our telescopes. And like us, galaxies grow and evolve over time. Unlike us, however, galactic evolution takes place on scales of millions to billions of years, meaning that observing any meaningful change in any individual galaxy is impossible on human timescales, leaving scientists interested in studying galactic evolution in a bit of a bind!
But there is a solution to this problem! Photons, particles of light, do not travel instantaneously but rather at a finite speed. This means that observations of distant galaxies serve as cosmic time capsules; the light from a galaxy one billion light years away has been in transit for one billion years, meaning that we are seeing that galaxy as it was a billion years ago.
With Galaxy Nurseries, we aim to discover lots of new galaxies very far away from us, in earlier stages of their development, and pass them on to the wider astronomical community. Finding galaxies and measuring their distance, however, is not easy! The WISP survey, which produced the data you will analyze, is great for this task. With WISP, we observe galaxies in two different ways, by taking both direct images of galaxies and images of galaxies' light split into different colors (or images of galaxies' spectra). This allows us to simultaneously find new galaxies (from the images) and measure their distances (from the spectra).
We have computer code that tries to do this for us, but the code produces many bogus detections of galaxies that must be filtered out by humans. By filtering the automatically identified galaxies from the false positives, you will help us discover some among the youngest and smallest galaxies known. In addition, we can use your classifications to create a new generation of galaxy detecting algorithms, one less susceptible to being fooled by spurious detections.
The WISP survey
WISP is Hubble Space Telescope project that uses the Wide Field Camera 3 (WFC3) in pure parallel mode. While the Hubble Space Telescope is observing one region of the sky with a different instrument, we are using the WFC3 camera simultaneously (in parallel) on a nearby patch of the sky - a very efficient and cost--effective strategy to obtain spectra for a large number of objects.
WISP obtains both images and spectra of all galaxies in the field of the instrument. When we take images of galaxies' spectra, the white light that enters the camera is decomposed into its many colors, each color corresponding to different wavelengths of light waves, similar to what happens when a rainbow is formed in the atmosphere after a storm. When certain atoms are present in the galaxy, that galaxy will emit light much more strongly at certain specific colors. We call these peaks in the spectrum ""emission lines.""

Measuring a galaxy's spectrum. Image Credit: Vihang Mehta
There is a lot a galaxy's emission lines can tell us about the galaxy; for example, if hydrogen lines are present in a galaxy's spectrum, that tells us that hydrogen is being ionized in the galaxy. Since hydrogen can only be ionized by very young, hot stars, we know that young stars are present in the galaxy, meaning that the galaxy is actively forming stars! Furthermore, since we know the exact color hydrogen lines are naturally, we can tell how fast the galaxy is moving away from us by how much the lines have been redshifted. Then, we use Hubble's law to relate the speed of the receding galaxy to how far it is from us.

The direct image (left) and dispersed spectrum (right) of a real galaxy from the WISP survey. The white arrow shows the bright light produced by an emission line. This galaxy actually appears as a subject in Galaxy Nurseries. Can you find it? Image Credit: Vihang Mehta
Be wary, though! Not everything that appears to be an emission line is in fact an emission line. There are various sources of contamination we have to be careful of, contamination that originates from the detector itself and from stars and galaxies close to the target. Sources of contamination are detailed in the field guide, which you will want to familiarize yourself with if you want to be an expert baby galaxy hunter."
