;ProjectName;Status;Link;About
141;Nest Quest Go: Western Bluebirds;paused;https://www.zooniverse.org/projects/brbcornell/nest-quest-go-western-bluebirds/about/research;"The Cornell Lab of Ornithology, nestled in the Finger Lakes Region, is a world-renowned ornithological research, education, and conservation facility. Amongst our collections, are more than 300,000 nest records from the North American Nest Record Card Program that ran from the 1960s until the early 2000s. Some cards predate the 1960s, but they are not the majority. Thousands of nesting birds, including Western Bluebirds, were observed by citizen scientists, who then submitted detailed accounts of bird nesting behavior.
NestWatch, a citizen-science project at the Lab, is working to transcribe this data in hopes of better understanding the nesting patterns of North American birds. Valuable scientific questions can be asked and answered regarding the nesting behavior of birds over time by examining historical records. We hope to bring new discoveries to light using these previously hidden datasets.
Western Bluebirds are a well-loved bird whose population has benefited from the increased use of nest boxes over the past thirty years. Understanding the historical nesting patterns and success or failures of this species will help to inform what we know today about their populations and how to better protect them into the future.
The research potential of this information is invaluable. Join us in meeting our goal of transcribing all of these nest records to better understand and protect birds. With over 30+ years of data we hope to be able to identify some of the challenges that have been impacting the lives of nesting birds such as; predation, pollution, cowbird parasitism, human disturbance, weather, etc. Along the way we hope to learn more about the citizen scientists behind the cards and preserve the valuable data they spent hours collecting. For the love of birds and people, happy transcription!"
142;Snapshot Molopo;paused;https://www.zooniverse.org/projects/shuebner729/snapshot-molopo/about/research;"Snapshot Safari – South Africa: Molopo Game Reserve
The aim of the Snapshot Safari – South Africa project is to provide extensive mammal occupancy and distribution data from conservation priority areas in South Africa as well as to develop and test survey methodology and conservation effectiveness assessments. This study will investigate how the structure and abundance of mammal communities, influenced by natural as well as anthropogenic processes, affects mammal species diversity and assemblages.
In response to the urgent need for more accurate assessment of mammal occupancy and populations we are launching a new research project called Snapshot Safari – South Africa as an expansion of Snapshot Serengeti, where citizen scientists worldwide helped to classify millions of photographs collected by a grid of camera traps in Tanzania’s Serengeti National Park.
Snapshot Safari – South Africa will include an unprecedented network of camera trap grids in dozens of protected areas and protected area expansion areas in South Africa to provide continuous monitoring of population sizes and trends of all the larger (>10 kg) mammal species at each site. Some of the participating study areas are managed as conservancies and stewardship areas, some are privately owned, some are state-run, and others are under communal tenure. With the help of accurate camera trap censuses, and innovative mapping approaches we will be able to identify which sites are being managed successfully - and hence which conservation strategies should be incorporated into a toolbox for effective wildlife management.
Snapshot Safari – South Africa will enable us to closely examine questions of species occupancy, species coexistence, competition, trophic interactions, the effect of change, and other ecological relationships across a variety of habitat types, community compositions, and management strategies. It will further provide a solid baseline for future monitoring of change as well as anthropogenic impacts. The results will contribute to the development and refinement of important methods to conserve species and ecosystems.
In addition to methods for calculating population size, camera traps also allow for a greater understanding of key demographic parameters. For example, using images of young animals, we gain information about breeding seasonality and duration, % females with young, and mortality of young. All of these are key parameters critical for both conservation management and conservation planning. Furthermore, the camera trap data are an important resource for understanding distribution and temporal occupancy for different mammal communities. Our data will document occupancy across seasons and years, allowing us to gain an understanding of seasonal occupancy.
The full data set that will be developed will be an important resource for future researchers and managers to study or gain information on environmental change, species dynamics, biodiversity patterns, species conservation status, conservation management, biodiversity planning and protected area monitoring."
143;Nest Quest Go: American Kestrels;paused;https://www.zooniverse.org/projects/brbcornell/nest-quest-go-american-kestrels/about/research;"The Cornell Lab of Ornithology, nestled in the Finger Lakes region of New York, is a world-renowned ornithological research, education, and conservation facility. Among our collections are more than 300,000 nest records from the North American Nest Record Card Program that ran from the 1960s until the early 2000s. Some cards pre-date the 1960s, likely because some naturalists were collecting this information before the formal program existed. Thousands of nesting birds, including American Kestrels, were observed by citizen scientists, who then submitted detailed accounts of bird nesting behavior.
NestWatch, a citizen-science project of the Lab, is working to transcribe these data in hopes of better understanding the nesting patterns of North American birds. Valuable scientific questions can be asked and answered regarding the nesting behavior of birds over time by examining historical records. We hope to bring new discoveries to light using these previously hidden datasets.
American Kestrels are the smallest raptors in North America and often build nests in nest boxes. Uniquely, these birds can live along-side humans in cities or in the country. They prefer to hunt in open grass and shrubland.
The research potential of this information is invaluable. Join us in meeting our goal of transcribing all of these nest records to better understand and protect birds. With over 30+ years of data we hope to be able to identify some of the challenges that have been impacting the lives of nesting birds such as; predation, pollution, cowbird parasitism, human disturbance, weather, etc. Along the way we hope to learn more about the citizen scientists behind the cards and preserve the valuable data they spent hours collecting. For the love of birds and people, happy transcription!"
144;Davy Notebooks Project;paused;https://www.zooniverse.org/projects/humphrydavy/davy-notebooks-project/about/research;"Research
Aims
Sir Humphry Davy (1778-1829) was perhaps the most famous chemist of the nineteenth century. This project aims to transcribe five of Davy’s early notebooks, which show his experiments in both chemistry and poetry.
The notebooks selected for this pilot run reveal how Davy’s mind worked and how his thinking developed. Containing details of his scientific experiments, poetry, geological observations, travel accounts, and personal philosophy, Davy's notebooks present us with a wide range of fascinating insights. Many of the pages of these notebooks have never been transcribed before. By transcribing these notebooks, we will find out more about the young Davy, his life, and the cultures and networks of which he was part.
The transcriptions produced by Zooniverse participants, and images of the manuscript pages, will later be published online on a custom-built, open access website, providing unprecedented access to these important historical documents. All individual participants will be given the option to be listed in the Acknowledgements section of the Davy Notebooks Project website. This is entirely optional, and at the sole discretion of each individual participant.
We hope that transcribers will also take part in the next run of our FutureLearn Massive Open Online Course (MOOC) ‘Humphry Davy: Laughing Gas, Literature, and the Lamp’. You will be able to sign up to this course at the end of July and the four-week course will begin on 28 October 2019.
Davy’s Notebooks in the RI
The RI holds an important collection of seventy-one unpublished notebooks written by Davy. Davy held several positions at the RI (Director of the Laboratory, 1801-25; Professor of Chemistry, 1802-12; Honorary Professor, 1813-23) and did his most important research there. The current run of the Davy Notebooks Project is intended as a pilot: we aim to transcribe five notebooks between June-September 2019. If successful, the project will later be expanded, and further notebooks will be transcribed. The notebooks to be transcribed during the current run are:
RI MS HD/13/C
Brown notebook (7"" x 4""), containing poems, essays, and philosophical and scientific notes; 150 manuscript pages; dating from 1801-02.
RI MS HD/13/D
Paper covered notebook (8½"" x 5½""), containing poetry, philosophy, and scientific notes; 28 manuscript pages; dating from 1800.
RI MS HD/13/F
Brown notebook with laurel wreath pattern on front (8½"" x 6½""), containing philosophical notes and poetry; 140 manuscript pages; dating from 1795-96.
RI MS HD/15/E
Notebook with parchment cover (6½"" x 4""), containing poetry and geological notes; 158 manuscript pages; dating from around 1804.
RI MS HD/15/F
Red leather-bound notebook (6"" x 4""); containing philosophical notes, poetry, and sketches; 136 manuscript pages; dating from around 1805.
ADDITIONAL NOTEBOOKS
Message from the Davy Notebooks Team, 29 July 2019:
The project has been a resounding success so far. Thanks so much to all our volunteers for helping us to transcribe these notebooks at such a phenomenal rate. As the first five notebooks have been transcribed ahead of time, we're going to add three additional notebooks to this pilot project. We may not manage to present final transcriptions of these on our website by December 2019, but will do so as soon as possible thereafter. As we're experimenting, each page of the next three notebooks will be transcribed by five volunteers rather than three before being retired.
Details of the additional notebooks will be added here, and on the Talk boards, as they are released.
RI MS HD/14/I
Marbled notebook, red spine and corners (6½"" x 9""); containing poetry, notes for Davy's later-published works Salmonia (1828) and Consolations in Travel (1830), and sketches; 146 manuscript pages + leaves a-e at front; dating from 1813-26.
RI MS HD/14/E
Calfskin-covered notebook, with vertical flap and cord (6"" x 4""); contains draft poetry (some copied from other notebooks), miscellaneous notes, and a daily journal (27 June-13 July 1827); 188 manuscript pages; dating from 1827.
RI MS HD/20/C
Marbled hard-covered notebook, in quarto size; contains Davy's notes of the period on chemistry and galvanic action; 174 manuscript pages; dating from 1800.
WEBSITE IS NOW LIVE
Message from the Davy Notebooks Team, 5 December 2019:
We’re delighted to announce that the website for the AHRC-funded project to crowdsource five of Humphry Davy’s notebooks is now online at http://humphrydavy.org.uk/notebooks/
More than 500 people from around the world participated in the notebook transcriptions. Many thanks once again to all our participants. The notebooks transcribed date from 1795-1805 and contain a mixture of Davy’s thoughts, scientific experiments, poetry, geological observations, travel accounts, and personal philosophy. The website is fully searchable and the final transcriptions of all 5 notebooks can be read online.
Davy's Life and Poetry
The videos below, which feature in the FutureLearn MOOC, provide a brief introduction to Davy's life and poetry.
Overview of Davy's Life
Davy Among the Poets I
Davy Among the Poets II
Acknowledgements
The Davy Notebooks Project team gratefully acknowledge the assistance of the AHRC in funding the project through its Follow-on Funding for Impact and Engagement scheme.
Davy Notebooks Project Consent Statement
By proceeding beyond this statement to the transcription task, you are giving your consent for your contribution(s) to be published on the Davy Notebooks Project website, a website that is free to access and open to the public, or in any other derivative work(s), for perpetuity. We reserve the right to use, reproduce, modify, adapt, publish, translate, create derivative works from, distribute, and exercise all copyright and publicity rights with respect to your contribution(s) worldwide and/or to incorporate your contribution(s) in other works in any media now known or later developed for the full term of any rights that may exist in your contribution(s). We also reserve the right not to publish any submitted contribution(s). All project data will be anonymised and securely stored on a password protected, encrypted Lancaster University server for a minimum period of ten years. For further information about how Lancaster University processes personal data for research purposes and your data rights, please click here."
145;Measuring Giraffes;paused;https://www.zooniverse.org/projects/derekedwardlee/measuring-giraffes/about/research;"The Wild Nature Institute conducts scientific research on endangered wildlife and inspires the public to protect wild nature.
Masai giraffes live only in Tanzania and Kenya, and their numbers are falling fast. Giraffes are vulnerable to extinction due to habitat loss and illegal hunting; their numbers have declined drastically to only 90,000. Masai giraffe numbers have declined over 50% in the last few decades!
Our work helps giraffes and people to coexist.
Our giraffe conservation research is discovering where Masai giraffes are doing well, where they are not, and why. Wild Nature Institute scientists are studying wild Masai giraffes in Tanzania using each animal’s unique fur pattern as identification.
We are monitoring thousands of individual giraffes throughout their lifetimes to document births, deaths, and movements. This is the world's biggest giraffe study and one of the biggest wildlife demography studies in history, covering 25,000 square kilometers in the Tarangire Ecosystem and Serengeti Ecosystem.
Our giraffe research is urgently needed so we can provide effective protection actions in an ever more fragmented world, and ensure the future of wild giraffes and all creatures of the savanna. In addition to our scientific conservation research, we use giraffe-themed environmental education and grassroots advocacy to protect and connect areas important to Masai giraffe conservation in Tanzania and around the world. We promote giraffe conservation through our Giraffe-themed conservation education and children's books, and we support anti-poaching activities to keep giraffes safe.

These kids are enjoying our giraffe education materials and activities.
We need your help to save giraffes. In addition to helping with this measuring project.
Donate Money or Time. Giving money and/or donating time to conservation groups like Wild Nature Institute is a great action to help giraffes. People can use their skills by providing advice, services, or goods in their personal area of expertise that can help the cause.
Raise Awareness about the Silent Extinction of Giraffes. Speak up within your social circles, and encourage others to donate money or time to saving giraffes. You can raise awareness in your home communities by writing, speaking, and contributing to the global conversation about our planet’s climate and biodiversity crises. Use the Hashtag #standtallforgiraffe
Plant Native Trees. Giraffes and many other species need native trees, but deforestation continues worldwide. Planting native trees helps fight the global climate crisis and helps biodiversity too!
Support Legal Protections for Wildlife. Laws like the Endangered Species Act and other environmental laws make the world safer for wildlife and people. Call and write to your congressperson, senator, governor, and president telling them you support strong law enforcement to protect wildlife.
We can craft a personal plan for you to become a giraffe hero. Email us at info@wildnatureinstitute.org.

Our study area in the Tarangire Ecosystem showing giraffe locations (purple dots) from our surveys in relation to protected areas (green shading), Maasai homesteads (grey dots), and towns (grey areas)."
146;Snapshot Elephants for Africa;paused;https://www.zooniverse.org/projects/shuebner729/snapshot-elephants-for-africa/about/research;"Elephants for Africa (EFA) is a UK charity and Botswana registered NGO, conducting research primarily on male African savannah elephant (Loxodonta africana, hereafter referred to as elephant) social behavior and group dynamics. In the past the vast majority of research into elephant sociality has focused on female society and group behavior, whilst males were written off as being solitary and antisocial. Nowadays there is a growing realization that male elephants are also social and spend time living in groups, however these social groups are very different from female breeding herds, and are a lot less well understood.

EFA collect long-term data on interactions and associations between individual bull elephants, which are identified using ear notch patterns and tusk morphology. We conduct our research in the Makgadikgadi Pans National Park (MPNP), in Botswana. The MPNP elephant population is of interest to us as it consists of predominantly bull elephants – over 95% of the elephants that we record are transient males. Therefore it is an ideal place to study the social behavior of the all-male groups found in this “bull area”. We are interested in understanding more about the social behavior of these males because we believe that the dynamic, fission-fusion nature of their interactions may influence behavior later in life, especially in terms of dominance hierarchies and behaviors such as crop raiding. Understanding male elephant social behavior, how it might differ in areas dominated by bulls from breeding herd areas, and what impact social interactions have on learning, dominance hierarchies and information transfer is also fundamental to being able to predict responses to changing ecological conditions and human encroachment.
To supplement our focal sighting data, EFA set up a network of camera traps which were running from 2014, until April 2017. These camera traps were located on elephant highways, well-worn pathways created by elephants, leading to the Boteti River in the MPNP. By monitoring elephant movement along these highways, we can investigate the demographics and group sizes of elephants using the highways, as well as their movement patterns in relation to factors such as time of day, season, river level, cropping season and moon phase. In addition, camera traps allow us an opportunity to investigate how group size and demographics may differ between day and night, as our driven research transects only take place during the day. From personal observation, it would also seem that the few female elephant breeding herds that are in the MPNP often drink from the river at night, and so may be under-represented in our transect data collection. Therefore camera traps are also an ideal tool to allow us to monitor the presence of breeding herds in the area.
Elephants are known as a “keystone species”; they can modify and maintain their habitat, often to the benefit of other species in the ecosystem. One way in which they can do this is by creating pathways in the environment, such as the elephant highways leading to the river. Our camera trap study also aims to investigate the spatial and temporal use of elephant highways, not only by elephants but also by other species. Our camera trap data forms a large part of our MPNP species monitoring and provides data on species composition within the park that are generally less easily obtainable from research drives and personal observation. Camera traps provide an effective method for collecting long-term data on the population demographics of species within the MPNP. Seasonal and annual changes in species populations, based on the frequency of their capture on our camera traps, can provide useful information about ecological changes in the park. Camera traps also have the added advantage of recording data continually, therefore can record the frequency of nocturnal species sightings and of the more elusive species that are rarely recorded during our transect drives. No other species monitoring of this nature is currently taking place in the MPNP, and so this important information will be fed back to the Department of Wildlife and National Parks, who manage the Park.
Various habitat types are found in the MPNP (Figure 1). A belt of tall, dense riparian Acacia woodland with a lower canopy of densely vegetated shrubland extends 2-5km from the riverbed. Moving further east, away from the river, the vegetation becomes more open Acacia savannah-type shrubland, and shrubbed grasslands. Further east still, the deep Kalahari sands give way to calcareous sandy loams, which support Schmidtia grasslands, with isolated stands of palm trees (Hyphaena petersiana). Finally, in the south east of the MPNP are the salt pans which give the Park its name, that form a mosaic with pan grasslands (Brooks, 2005).

Figure 1. Map of habitat types in the Makgadikgadi Pans National Park (from Hemson 2003).
References
Brooks, C. J. (2005) The foraging behaviour of Burchell’s zebra (Equus burchelli antiquorum). (Unpublished Ph.D thesis). University of Bristol, Bristol, England.
Hemson, G. (2003) The ecology and conservation of lions: human–wildlife conflict in semi-arid Botswana. (Unpublished Ph.D. thesis). University of Oxford, Oxford, England.
Pitfield, A. (2017) The social and environmental factors affecting the life of bull African elephants (Loxodonta africana) in a ‘bull area’ – a social network analysis. (Unpublished Masters thesis). University of Bristol, Bristol, England."
